{
  "uats_version": "1.0.0",
  "api": {
    "name": "Linear Comments",
    "base_url": "${MDEMG_BASE_URL}",
    "version": "v1",
    "service": "mdemg",
    "tags": [
      "linear",
      "comments",
      "crud"
    ]
  },
  "metadata": {
    "author": "reh3376",
    "created": "2026-03-10",
    "description": "Validates /v1/linear/comments operations",
    "test_type": "contract",
    "priority": "low"
  },
  "config": {
    "timeout_ms": 15000,
    "sha256": "39a0493d4266f7b004cf5b09515903cd46030289f45b78b0b2533b40f8f7df2e"
  },
  "variables": {},
  "request": {
    "method": "POST",
    "path": "/v1/linear/comments",
    "body": {
      "issue_id": "test-issue",
      "body": "test comment"
    },
    "headers": {
      "Content-Type": "application/json"
    }
  },
  "expected": {
    "status": 503,
    "body_assertions": [
      {
        "path": "$.error",
        "type": "string"
      }
    ]
  },
  "variants": [
    {
      "name": "get_not_allowed",
      "description": "GET should return 405",
      "request": {
        "method": "GET",
        "path": "/v1/linear/comments"
      },
      "expected": {
        "status": 405,
        "body_assertions": [
          {
            "path": "$.error",
            "type": "string"
          }
        ]
      }
    }
  ]
}
