{
  "uats_version": "1.0.0",
  "api": {
    "name": "Prune Learning Edges",
    "base_url": "${MDEMG_BASE_URL}",
    "version": "v1",
    "service": "mdemg",
    "tags": [
      "learning",
      "prune",
      "write"
    ]
  },
  "metadata": {
    "author": "reh3376",
    "created": "2026-01-29",
    "description": "Validates Prune Learning Edges endpoint",
    "test_type": "contract",
    "priority": "medium"
  },
  "config": {
    "timeout_ms": 15000,
    "sha256": "b3e4f334c771676413c07f03a31e780ea4a44dc05ce0c63964f84f8bfdff7543"
  },
  "variables": {
    "test_space": "uats-prune-test"
  },
  "request": {
    "method": "POST",
    "path": "/v1/learning/prune",
    "query": {
      "space_id": "{{test_space}}"
    },
    "headers": {
      "Content-Type": "application/json"
    }
  },
  "expected": {
    "status": 200,
    "body_assertions": [
      {
        "path": "$.space_id",
        "op": "type_is",
        "expected": "string"
      },
      {
        "path": "$.decayed_deleted",
        "op": "type_is",
        "expected": "integer"
      },
      {
        "path": "$.excess_deleted",
        "op": "type_is",
        "expected": "integer"
      },
      {
        "path": "$.total_deleted",
        "op": "type_is",
        "expected": "integer"
      }
    ]
  }
}
