{
  "uats_version": "1.0.0",
  "api": {
    "name": "Ingest Codebase Job Status",
    "base_url": "${MDEMG_BASE_URL}",
    "version": "v1",
    "service": "mdemg",
    "operation_id": "getIngestCodebaseJobStatus",
    "tags": [
      "memory",
      "ingest",
      "codebase",
      "jobs",
      "read"
    ]
  },
  "metadata": {
    "author": "reh3376",
    "created": "2026-01-29",
    "description": "Get status and statistics for a running or completed ingest-codebase job",
    "test_type": "contract",
    "priority": "high",
    "status": "active"
  },
  "config": {
    "timeout_ms": 5000,
    "ignore_fields": [
      "$.stats.duration",
      "$.stats.rate"
    ],
    "sha256": "b84f64bec581cc2a02e9ea1f5bcf7c50db391aa54dcf86bd6dd1c676e81d9e87"
  },
  "variables": {
    "job_id": "nonexistent-job-id"
  },
  "request": {
    "method": "GET",
    "path": "/v1/memory/ingest-codebase/{{job_id}}"
  },
  "expected": {
    "status": [
      200,
      404
    ],
    "body_assertions": [
      {
        "name": "job_id returned when found",
        "optional": true,
        "path": "$.job_id",
        "op": "type_is",
        "expected": "string"
      },
      {
        "name": "status value when found",
        "optional": true,
        "path": "$.status",
        "op": "one_of",
        "expected": [
          "queued",
          "running",
          "completed",
          "failed",
          "cancelled"
        ]
      },
      {
        "name": "error when not found",
        "optional": true,
        "path": "$.error",
        "op": "type_is",
        "expected": "string"
      }
    ]
  },
  "variants": [
    {
      "name": "job_found_completed",
      "description": "Response structure when job is completed (requires real job)",
      "skip": true,
      "skip_reason": "Requires test setup: create job first, then check status",
      "expected": {
        "status": 200,
        "body_assertions": [
          {
            "path": "$.job_id",
            "op": "type_is",
            "expected": "string"
          },
          {
            "path": "$.status",
            "op": "equals",
            "expected": "completed"
          },
          {
            "path": "$.space_id",
            "op": "type_is",
            "expected": "string"
          },
          {
            "path": "$.path",
            "op": "type_is",
            "expected": "string"
          },
          {
            "path": "$.stats",
            "op": "type_is",
            "expected": "object"
          },
          {
            "path": "$.stats.files_found",
            "op": "type_is",
            "expected": "integer"
          },
          {
            "path": "$.stats.files_processed",
            "op": "type_is",
            "expected": "integer"
          },
          {
            "path": "$.stats.symbols_extracted",
            "op": "type_is",
            "expected": "integer"
          },
          {
            "path": "$.stats.errors",
            "op": "type_is",
            "expected": "integer"
          }
        ]
      }
    },
    {
      "name": "job_found_running",
      "description": "Response structure when job is running (requires real job)",
      "skip": true,
      "skip_reason": "Requires test setup: create job and check while running",
      "expected": {
        "status": 200,
        "body_assertions": [
          {
            "path": "$.job_id",
            "op": "type_is",
            "expected": "string"
          },
          {
            "path": "$.status",
            "op": "equals",
            "expected": "running"
          },
          {
            "path": "$.stats.files_processed",
            "op": "type_is",
            "expected": "integer"
          },
          {
            "optional": true,
            "path": "$.stats.rate",
            "op": "type_is",
            "expected": "number"
          }
        ]
      }
    },
    {
      "name": "job_not_found",
      "description": "Should return 404 for non-existent job",
      "variables": {
        "job_id": "definitely-not-a-real-job-id-12345"
      },
      "expected": {
        "status": 404,
        "body_assertions": [
          {
            "path": "$.error",
            "op": "contains",
            "expected": "not found"
          }
        ]
      }
    },
    {
      "name": "empty_job_id",
      "description": "Empty job_id should list all jobs",
      "request": {
        "method": "GET",
        "path": "/v1/memory/ingest-codebase"
      },
      "expected": {
        "status": 200,
        "body_assertions": [
          {
            "path": "$.jobs",
            "op": "type_is",
            "expected": "array"
          }
        ]
      }
    }
  ]
}
