{
  "uats_version": "1.0.0",
  "api": {
    "name": "Self-Improve Report",
    "base_url": "${MDEMG_BASE_URL}",
    "version": "v1",
    "service": "mdemg",
    "tags": [
      "rsic",
      "self-improve",
      "report"
    ]
  },
  "metadata": {
    "author": "reh3376",
    "created": "2026-02-07",
    "description": "Validates RSIC active task report endpoint",
    "test_type": "contract",
    "priority": "low"
  },
  "config": {
    "timeout_ms": 10000,
    "tags": [
      "rsic"
    ],
    "sha256": "6abb48cc7160f0ab85b0b68228c354d1b0ac5113e09c0342d1b3a0850cb3e510"
  },
  "request": {
    "method": "GET",
    "path": "/v1/self-improve/report"
  },
  "expected": {
    "status": 200,
    "body_assertions": [
      {
        "path": "$.active_tasks",
        "op": "type_is",
        "expected": "object"
      }
    ]
  }
}
