{
  "uats_version": "1.0.0",
  "api": {
    "name": "Recall Skill Content",
    "base_url": "${MDEMG_BASE_URL}",
    "version": "v1",
    "service": "mdemg",
    "tags": [
      "skills",
      "recall",
      "read"
    ]
  },
  "metadata": {
    "author": "reh3376",
    "created": "2026-02-07",
    "description": "Validates that POST /v1/skills/{name}/recall returns skill content via tag-filtered recall",
    "test_type": "contract",
    "priority": "medium"
  },
  "config": {
    "timeout_ms": 15000,
    "sha256": "c0ebf8f7928f8f55e04349eee4d73465996cb2209896d9870a275efedfb1d59b"
  },
  "variables": {
    "test_space": "uats-skills-recall-test"
  },
  "request": {
    "method": "POST",
    "path": "/v1/skills/uats-test-skill/recall",
    "body": {
      "space_id": "{{test_space}}",
      "top_k": 5
    },
    "headers": {
      "Content-Type": "application/json"
    }
  },
  "expected": {
    "status": 200,
    "body_assertions": [
      {
        "path": "$.skill",
        "op": "type_is",
        "expected": "string"
      },
      {
        "path": "$.space_id",
        "op": "type_is",
        "expected": "string"
      },
      {
        "path": "$.query",
        "op": "type_is",
        "expected": "string"
      },
      {
        "path": "$.results",
        "op": "type_is",
        "expected": "array"
      }
    ]
  }
}
