{
  "uats_version": "1.0.0",
  "api": {
    "name": "Get Backup Manifest",
    "base_url": "${MDEMG_BASE_URL}",
    "version": "v1",
    "service": "mdemg",
    "tags": [
      "backup",
      "manifest",
      "read"
    ]
  },
  "metadata": {
    "author": "reh3376",
    "created": "2026-02-07",
    "description": "Validates GET /v1/backup/manifest/{id} returns 404 for nonexistent backup",
    "test_type": "contract",
    "priority": "medium"
  },
  "config": {
    "timeout_ms": 10000,
    "sha256": "a32913c22b1f6745bb2fbfe435fffd3867582918f352cce3e0272ca2933bdd3a",
    "tags": [
      "embedding_required"
    ]
  },
  "variables": {},
  "request": {
    "method": "GET",
    "path": "/v1/backup/manifest/nonexistent-backup-id",
    "headers": {
      "Content-Type": "application/json"
    }
  },
  "expected": {
    "status": 404,
    "body_assertions": [
      {
        "path": "$.error",
        "type": "string"
      }
    ]
  }
}
