{
  "uats_version": "1.0.0",
  "api": {
    "name": "Self-Improve Health",
    "base_url": "${MDEMG_BASE_URL}",
    "version": "v1",
    "service": "mdemg",
    "tags": [
      "rsic",
      "self-improve",
      "health"
    ]
  },
  "metadata": {
    "author": "reh3376",
    "created": "2026-02-07",
    "description": "Validates RSIC health/watchdog status endpoint",
    "test_type": "contract",
    "priority": "low"
  },
  "config": {
    "timeout_ms": 10000,
    "tags": [
      "rsic"
    ],
    "sha256": "fd26b5ef91da23a798f986644f4fce081d467574c4de5d019ea0183d1c9cf25e"
  },
  "request": {
    "method": "GET",
    "path": "/v1/self-improve/health"
  },
  "expected": {
    "status": 200,
    "body_assertions": [
      {
        "path": "$.status",
        "op": "type_is",
        "expected": "string"
      },
      {
        "path": "$.active_tasks",
        "op": "type_is",
        "expected": "integer"
      }
    ]
  }
}
