{
  "uats_version": "1.0.0",
  "api": {
    "name": "Neural Sidecar Status",
    "base_url": "${MDEMG_BASE_URL}",
    "version": "v1",
    "service": "mdemg",
    "tags": [
      "neural",
      "observability"
    ]
  },
  "metadata": {
    "author": "agent",
    "created": "2026-03-19",
    "description": "Query neural sidecar status and collection stats (NR-3).",
    "test_type": "contract",
    "priority": "low"
  },
  "config": {
    "timeout_ms": 5000,
    "tags": [
      "neural",
      "observability"
    ],
    "sha256": "5e8e8f76c7a3eab313893249b1507e2ccc9ff7b789e0f09f2348ab92f19aaf24"
  },
  "variables": {},
  "request": {
    "method": "GET",
    "path": "/v1/neural/status",
    "headers": {
      "Content-Type": "application/json"
    }
  },
  "expected": {
    "status": 200,
    "body_assertions": [
      {
        "name": "sidecar_enabled exists",
        "path": "$.sidecar_enabled",
        "exists": true
      }
    ]
  },
  "variants": [
    {
      "name": "method_not_allowed",
      "description": "POST should return 405",
      "request": {
        "method": "POST",
        "path": "/v1/neural/status",
        "body": {}
      },
      "expected": {
        "status": 405
      }
    }
  ]
}
